<?xml version="1.0" encoding="utf-8"?>
<!DOCTYPE proizvodi SYSTEM "proizvodi.dtd">
<proizvodi xmlns:xsi="http://www.w3.org/2001/XMLSchema-instance"
           xsi:noNamespaceSchemaLocation="proizvodi.xsd">
  <proizvod>
    <kategorija naziv="laptop"></kategorija>
    <cena valuta="rsd">90000</cena>
    <tekstOglasa>Neki tekst ogalsa</tekstOglasa>
    <oznake>
      <oznaka>akcija</oznaka>
    </oznake>
    <akcije>
      <akcija cena="80000" datumIsteka="2021-09-01"></akcija>
    </akcije>
  </proizvod>
</proizvodi>